{
  "name": "burnt",
  "description": "Burnt orange accents with earthy syntax colors",
  "dark": {
    "accent": "#e5792f",
    "heading1": "#7aa2f7",
    "heading": "#7aa2f7",
    "path": "#7aa2f7",
    "command": "#7aa2f7",
    "shimmer": "#f3c78a",
    "shimmerEnd": "#f9dec0",
    "keyword": "#ef9148",
    "string": "#bbc58a",
    "number": "#d9a45c"
  },
  "light": {
    "accent": "#b8510f",
    "heading1": "#285f9e",
    "heading": "#285f9e",
    "path": "#285f9e",
    "command": "#285f9e",
    "shimmer": "#77320b",
    "shimmerEnd": "#65350d",
    "keyword": "#a8470c",
    "string": "#576a25",
    "number": "#94671f"
  }
}
