{
  "name": "mono",
  "description": "Neutral accents and syntax with sky-blue references and colored status indicators",
  "dark": {
    "accent": "#e6e6e6",
    "heading1": "#7aa2f7",
    "heading": "#7aa2f7",
    "path": "#7aa2f7",
    "command": "#7aa2f7",
    "shimmer": "#e0e0e0",
    "shimmerEnd": "#f2f2f2",
    "keyword": "#e6e6e6",
    "string": "#bdbdbd",
    "number": "#cfcfcf"
  },
  "light": {
    "accent": "#111111",
    "heading1": "#285f9e",
    "heading": "#285f9e",
    "path": "#285f9e",
    "command": "#285f9e",
    "shimmer": "#333333",
    "shimmerEnd": "#111111",
    "keyword": "#111111",
    "string": "#444444",
    "number": "#333333"
  }
}
