{
  "name": "amber",
  "description": "Warm gold accents with sky-blue references",
  "dark": {
    "accent": "#e9a23b",
    "heading1": "#7aa2f7",
    "heading": "#7aa2f7",
    "path": "#7aa2f7",
    "command": "#7aa2f7",
    "shimmer": "#f5d6a0",
    "shimmerEnd": "#f8e6c6",
    "keyword": "#dd8f63",
    "string": "#c6cd8a",
    "number": "#e5b783"
  },
  "light": {
    "accent": "#b86e0a",
    "heading1": "#285f9e",
    "heading": "#285f9e",
    "path": "#285f9e",
    "command": "#285f9e",
    "shimmer": "#704307",
    "shimmerEnd": "#593705",
    "keyword": "#a8610a",
    "string": "#576c24",
    "number": "#9a5128"
  }
}
