{
  "name": "lavender",
  "description": "Soft violet accents with sky-blue references",
  "dark": {
    "accent": "#a99cf0",
    "heading1": "#7aa2f7",
    "heading": "#7aa2f7",
    "path": "#7aa2f7",
    "command": "#7aa2f7",
    "shimmer": "#d9d1fa",
    "shimmerEnd": "#e5e0fc",
    "keyword": "#b4a6ee",
    "string": "#99cbbd",
    "number": "#e2b07a"
  },
  "light": {
    "accent": "#5848b8",
    "heading1": "#285f9e",
    "heading": "#285f9e",
    "path": "#285f9e",
    "command": "#285f9e",
    "shimmer": "#392d7b",
    "shimmerEnd": "#302468",
    "keyword": "#5848b8",
    "string": "#2d7160",
    "number": "#94601f"
  }
}
